{
  "$schema": "https://json-schema.org/draft/2020-12/schema",
  "$id": "https://zentinel.dev/schemas/pipeline.escalation.v1.schema.json",
  "title": "zentinel pipeline escalation record v1",
  "description": "A record that an active task escalated to deeper review, a prerequisite task, or a user decision. Carries the complexity class, final outcome, and monotonic required-gate evidence.",
  "type": "object",
  "additionalProperties": false,
  "required": [
    "schema_version",
    "task_id",
    "trigger",
    "evidence",
    "attempted_recovery",
    "required_decision",
    "recommended_autonomous_action",
    "user_input_required"
  ],
  "properties": {
    "schema_version": {
      "description": "Pinned schema identity for this artifact.",
      "const": "zentinel.pipeline.escalation.v1"
    },
    "task_id": {
      "description": "Three-digit task id that escalated.",
      "type": "string",
      "pattern": "^[0-9]{3}$"
    },
    "trigger": {
      "description": "The escalation trigger (for example survivor_after_retry_limit, compiler_internal_risk, public_contract_ambiguity).",
      "type": "string",
      "minLength": 1
    },
    "evidence": {
      "description": "Paths or references proving the trigger fired.",
      "type": "array",
      "items": { "type": "string" }
    },
    "attempted_recovery": {
      "description": "Recovery steps tried before escalating.",
      "type": "array",
      "items": { "type": "string" }
    },
    "required_decision": {
      "description": "The decision the escalation needs (for example architecture_review).",
      "type": "string",
      "minLength": 1
    },
    "recommended_autonomous_action": {
      "description": "The action the agent recommends taking without a human when the user_input boundary is not reached.",
      "type": "string"
    },
    "user_input_required": {
      "description": "True only when the escalation requires an explicit user decision.",
      "type": "boolean"
    },
    "task_class": {
      "description": "The escalation complexity class.",
      "enum": ["low_risk", "normal", "high_risk", "compiler_internal", "architecture"]
    },
    "outcome": {
      "description": "The single terminal escalation outcome.",
      "enum": [
        "retry_same_task",
        "return_to_test_author",
        "create_prerequisite_task",
        "architecture_review_required",
        "blocked_needs_user"
      ]
    },
    "required_gates": {
      "description": "The gates required for the task_class. Monotonic: a higher class must include every gate of every lower class.",
      "type": "array",
      "items": { "type": "string" }
    },
    "required_reviewers": {
      "description": "The reviewers required for the task_class (for example Architecture Reviewer and Property Test Agent for compiler_internal).",
      "type": "array",
      "items": { "type": "string" }
    }
  }
}
