{
  "schema_version": "zentinel.pipeline.escalation.v1",
  "task_id": "049",
  "task_class": "normal",
  "trigger": "repeated_test_failure",
  "evidence": [
    "artifacts/pipeline/049/escalation/normal.txt"
  ],
  "attempted_recovery": [
    "bounded fix within task scope"
  ],
  "required_decision": "joint_review",
  "recommended_autonomous_action": "create focused follow-up task",
  "user_input_required": false,
  "outcome": "return_to_test_author",
  "required_gates": [
    "task_system_validation",
    "targeted_check",
    "unit_tests"
  ],
  "required_reviewers": [
    "Test Reviewer",
    "Implementation Reviewer",
    "Verifier"
  ]
}
