{
  "schema_version": "zentinel.pipeline.escalation.v1",
  "task_id": "043",
  "trigger": "survivor_after_retry_limit",
  "evidence": [
    "artifacts/pipeline/043/mutation/report.json"
  ],
  "attempted_recovery": [
    "added boundary fixture",
    "reran mutation gate"
  ],
  "required_decision": "architecture_review",
  "recommended_autonomous_action": "create focused source-mapping follow-up task",
  "user_input_required": false
}
