{
  "schema_version": "zentinel.pipeline.escalation.v1",
  "task_id": "049",
  "task_class": "architecture",
  "trigger": "public_contract_ambiguity",
  "evidence": [
    "artifacts/pipeline/049/escalation/architecture.txt"
  ],
  "attempted_recovery": [
    "bounded fix within task scope"
  ],
  "required_decision": "contract_review",
  "recommended_autonomous_action": "create focused follow-up task",
  "user_input_required": false,
  "outcome": "create_prerequisite_task",
  "required_gates": [
    "task_system_validation",
    "contract_validation",
    "doctest_readiness"
  ],
  "required_reviewers": [
    "Phase Planner",
    "Contract Editor",
    "Architecture Reviewer",
    "Verifier"
  ]
}
